{
  "metadata": {
    "solution": "01-copilot-readiness-scanner",
    "solutionCode": "01",
    "exportVersion": "1.1.0",
    "exportedAt": "2026-07-12T16:00:00Z",
    "tier": "baseline"
  },
  "summary": {
    "overallStatus": "monitor-only",
    "disposition": "BLOCKED",
    "recordCount": 1
  },
  "controls": [
    {
      "controlId": "1.1",
      "status": "monitor-only",
      "notes": "Fixture data for portable package path validation."
    }
  ],
  "artifacts": [
    {
      "name": "lab-summary",
      "type": "json",
      "path": "artifacts/lab-summary.json",
      "hash": "3f5408137d59bca8c7aba705527160f2ef72fe740520e53443392d033e5274a1"
    }
  ]
}
